{
  "schemaVersion": 2,
  "id": "C-CAMPAIGN",
  "createdAt": "2000-01-01T00:00:00Z",
  "updatedAt": "2000-01-01T00:00:00Z",
  "revision": 1,
  "createdBy": "manager",
  "updatedBy": "manager",
  "digest": "sha256:0000000000000000000000000000000000000000000000000000000000000000",
  "correlationId": "campaign-open",
  "title": "Campaign title",
  "slug": "campaign-slug",
  "objective": "Observable campaign objective",
  "scope": [],
  "exclusions": [],
  "successCriteria": ["Observable success condition"],
  "closureCriteria": ["All closure coverage gates pass"],
  "status": "open",
  "currentFocus": ["W-0001"],
  "milestones": [],
  "owner": "manager",
  "permittedManagers": ["manager"],
  "openedAt": "2000-01-01T00:00:00Z",
  "lastEventId": "E-20000101-000000-OPEN00"
}
